state,category,description,citation,notes
Tennessee,Residency Requirement,Only citizens of Tennessee have right to inspect and receive public records,T.C.A. ยง 10-7-503,Restricts to state residents only
Tennessee,7-Day Response Required,"Must respond within 7 business days: provide records, deny, or furnish completed response form with timeline",T.C.A. ยง 10-7-503,Structured response requirement
Tennessee,Public Records Request Coordinator,Each entity must designate PRRC responsible for prompt and efficient processing,T.C.A. ยง 10-7-503,Mandatory designated coordinator
Tennessee,Office of Open Records Counsel,"Provides guidance, develops standard forms, assists with disputes",T.C.A. ยง 10-7-503,Oversight and assistance office
Tennessee,563 Exemptions,"As of 2018, 563 exemptions exist throughout Tennessee Code",Various,Extensive exemption structure
