state,category,description,citation,notes
South Dakota,Presumption Reversal (2009),"Prior to 2009, records presumed confidential; SB 147 reversed to presumption of public access",SDCL 1-27-1,Major 2009 reform reversing presumption
South Dakota,50th in Transparency (2008),Better Government Association ranked South Dakota 50th for transparency in 2008,Historical,Pre-reform poor ranking
South Dakota,Office of Hearing Examiners,Administrative appeals through hearing examiners with binding decisions,SDCL 1-27-38 through 1-27-43,Administrative law judge review
South Dakota,First Hour Free,May charge fees after first hour of staff time,SDCL 1-27-35,Initial hour free
South Dakota,10-Day Response for Written Requests,Written requests must receive response within 10 business days,SDCL 1-27-35,Deadline for written requests
